{
  "$schema": "https://json-schema.org/draft/2020-12/schema",
  "$id": "https://kineticdiskcover.dev/schemas/run_status.schema.json",
  "title": "KineticDiskCover execution status",
  "type": "object",
  "additionalProperties": false,
  "required": [
    "schema_version",
    "run_id",
    "state",
    "updated_at",
    "process_id"
  ],
  "properties": {
    "schema_version": { "const": 1 },
    "run_id": { "type": "string", "minLength": 1 },
    "state": {
      "enum": [
        "PLANNED",
        "RUNNING",
        "COMPLETED",
        "FAILED",
        "TIME_LIMIT",
        "TIMED_OUT",
        "CANCELLED",
        "INVALID",
        "SKIPPED",
        "ABANDONED"
      ]
    },
    "updated_at": { "type": "string", "format": "date-time" },
    "started_at": { "type": ["string", "null"], "format": "date-time" },
    "process_id": { "type": ["integer", "null"], "minimum": 0 },
    "message": { "type": ["string", "null"] }
  }
}
