{
  "message": null,
  "process_id": null,
  "run_id": "run_20261012T042833Z__branch-and-bound__minmaxsum__C-lower-90fec4bb6118-801fe3006e__r00__83d725c4a5f5",
  "schema_version": 1,
  "started_at": "2026-10-12T04:28:33.036268Z",
  "state": "TIME_LIMIT",
  "updated_at": "2026-10-12T04:28:37.613505Z"
}
