{
  "message": null,
  "process_id": null,
  "run_id": "run_20261012T042127Z__brute-force__minmaxsum__sbgdb-20200507-fpg-poly_0000000030-749__r00__963d8915b6fa",
  "schema_version": 1,
  "started_at": "2026-10-12T04:21:27.281826Z",
  "state": "COMPLETED",
  "updated_at": "2026-10-12T04:21:27.317598Z"
}
